{"type":"config","name":"System-Wide Integration Performance Optimization","metricName":"total_µs","metricUnit":"µs","bestDirection":"lower"}
{"type":"config","name":"System-Wide Integration Testing & Performance","metricName":"total_µs","metricUnit":"µs","bestDirection":"lower"}
{"run":1,"commit":"640fcde","metric":0,"metrics":{},"status":"crash","description":"Initial baseline run for system-wide integration performance test case. Failed immediately.","timestamp":1775619343911,"segment":0,"confidence":null,"iterationTokens":null,"asi":{"error_details":"Exit code 2 observed. This indicates a failure in the core integration workload. Need to review code paths in ar_system, ar_agency, ar_delegation, etc., to find the root cause of the failure before retrying performance measurements.","initial_debug_step":"Review build logs and test output for the root cause of failure 2."}}
{"run":2,"commit":"f9dadd8","metric":0,"metrics":{},"status":"keep","description":"Fixed critical build linking issue on macOS by updating Makefile to correctly link libC for Zig tests. Verified with 'make build' and 'make check-logs'.","timestamp":1775623821135,"segment":0,"confidence":null,"iterationTokens":null,"asi":{"build_command_used":"make build 2>&1","check_logs_passed":true,"fix_applied":"Updated Makefile to set ZIG_TEST_LINK_FLAGS and ZIG_TEST_TSAN_FLAGS to correctly link libc on macOS (Darwin) and appropriately adjust TSan flags.","issue_resolved":"macOS linking failure for Zig tests due to missing system C library linkage definitions.","mac_os_fix":true,"test_suite_fix":"Updated rules for bin/%Tests, $(RUN_TESTS_DIR)/%Tests, $(SANITIZE_TESTS_DIR)/%Tests, $(TSAN_TESTS_DIR)/%Tests"}}
{"run":3,"commit":"f9dadd8","metric":0,"metrics":{},"status":"crash","description":"Crash: benchmark harness failed at link time because autoresearch.sh links against nonexistent -lar_system instead of the built libagerun archive; no performance measurement collected.","timestamp":1775626480930,"segment":0,"confidence":null,"iterationTokens":null,"asi":{"hypothesis":"Current autoresearch.sh benchmark harness can be built and run as-is to establish a baseline total_µs measurement.","rollback_reason":"Run crashed before producing any metric because the benchmark command failed to link on macOS.","next_action_hint":"Switch experiment command to the faster make ar_integration_performance_tests target requested by the user and ensure that target emits a stable total_µs metric for autoresearch.","error_details":"ld: library 'ar_system' not found; clang linker exited 1 during ./autoresearch.sh","learning":"The current benchmark wrapper is broken independently of runtime performance, so the experiment command itself must be corrected before further optimization."}}
{"type":"config","name":"Integration Performance via make ar_integration_performance_tests","metricName":"total_µs","metricUnit":"µs","bestDirection":"lower"}
{"run":4,"commit":"f9dadd8","metric":0,"metrics":{},"status":"crash","description":"Crash: attempted to switch the benchmark command directly to make ar_integration_performance_tests, but autoresearch runner enforces using autoresearch.sh when that file exists.","timestamp":1775626652196,"segment":1,"confidence":null,"iterationTokens":null,"asi":{"hypothesis":"The experiment loop can directly run make ar_integration_performance_tests after reinitializing the session for the new target.","rollback_reason":"The autoresearch harness rejected the custom command because autoresearch.sh is present and mandatory in this repo.","next_action_hint":"Update autoresearch.sh itself to invoke make ar_integration_performance_tests so the loop uses the requested faster-turnaround target.","error_details":"run_experiment rejected custom command and instructed to use ./autoresearch.sh instead","learning":"In this harness, changing the experiment command requires changing autoresearch.sh, not only autoresearch.md or init_experiment metadata."}}
{"run":5,"commit":"f9dadd8","metric":0,"metrics":{},"status":"crash","description":"Crash: new make-based benchmark target builds and starts, but agent creation fails at agent 64 before any metric is emitted.","timestamp":1775626735754,"segment":1,"confidence":null,"iterationTokens":4047,"asi":{"hypothesis":"A dedicated make ar_integration_performance_tests benchmark target with a ring-node method can run the 100-agent/1000-message workload and emit total_µs quickly enough for iterative autoresearch.","rollback_reason":"The benchmark cannot establish a baseline because ar_agency__create_agent starts failing partway through ring construction.","next_action_hint":"Inspect agent-capacity limits or initialization failures around the 64th agent, then either align the benchmark with actual supported capacity or remove the bottleneck in agent creation.","error_details":"make ar_integration_performance_tests failed with 'Failed to create benchmark agent 64' after repeated methodology lookup logs","learning":"The requested faster-turnaround harness is wired up correctly enough to compile and execute, but the runtime currently cannot sustain the 100-agent benchmark workload."}}
{"run":6,"commit":"f9dadd8","metric":0,"metrics":{},"status":"crash","description":"Crash: autoresearch.sh now runs make ar_integration_performance_tests as requested, but the benchmark still fails during setup when creating benchmark agent 64.","timestamp":1775626829502,"segment":1,"confidence":null,"iterationTokens":8202,"asi":{"hypothesis":"Switching autoresearch.sh to make ar_integration_performance_tests will provide the faster benchmark loop requested by the user and allow a baseline run.","rollback_reason":"The command switch worked, but the benchmark itself still crashes before emitting total_µs because agent creation fails at 64.","next_action_hint":"Investigate the 64-agent creation ceiling in runtime structures or adjust the benchmark only if the documented workload is provably unsupported and the objective is updated.","error_details":"./autoresearch.sh executes make ar_integration_performance_tests; make fails with 'Failed to create benchmark agent 64'","learning":"The experiment command is now correctly switched to the make target; remaining failures are in runtime capacity/benchmark setup, not in the harness command."}}
{"run":7,"commit":"f9dadd8","metric":0,"metrics":{},"status":"crash","description":"Crash: increasing ar_map capacity removed the 64-agent registry ceiling, but the new benchmark still failed after one message because agents were created with NULL context and frame creation requires non-NULL context.","timestamp":1775627022671,"segment":1,"confidence":null,"iterationTokens":16207,"asi":{"hypothesis":"Raising fixed ar_map capacity above 100 and using the make-based benchmark harness will be enough to establish a successful 100-agent baseline.","rollback_reason":"The runtime progressed past agent creation but failed in execution because ar_frame__create requires non-NULL context for each agent.","next_action_hint":"Rebuild the benchmark to keep a shared context map alive for all agents during the entire run, then retry the baseline.","error_details":"Benchmark stopped after 1 message with 'ERROR: Failed to create execution frame' and log evidence showed agent 1 executed before failing.","learning":"The 64-agent failure was caused by the fixed-size ar_map in agent registry tracking, but the benchmark also must satisfy the non-NULL context prerequisite documented for frame creation."}}
{"run":8,"commit":"f5ae4c5","metric":88115,"metrics":{},"status":"keep","description":"Established first successful make-based integration benchmark baseline by raising fixed ar_map capacity from 64 to 128 for 100-agent registry tracking and keeping a shared context alive for all benchmark agents.","timestamp":1775627095206,"segment":1,"confidence":null,"iterationTokens":3239,"asi":{"hypothesis":"The benchmark can be made to run successfully by removing the 64-entry registry bottleneck in ar_map and satisfying the frame subsystem's non-NULL context requirement with a shared benchmark context.","root_cause":"ar_agent_registry uses ar_map internally; fixed MAP_SIZE 64 prevented tracking the 65th+ agent, and NULL agent contexts caused ar_frame__create to fail during execution.","benchmark_setup":"autoresearch.sh now runs make ar_integration_performance_tests; benchmark creates 100 ring agents with shared context and processes 1000 messages.","learning":"The benchmark currently spends substantial time printing per-message output and debug logs, which is likely the dominant remaining performance bottleneck.","capacity_fix":"modules/ar_map.c MAP_SIZE 64 -> 128","context_fix":"modules/ar_integration_performance_tests.c now passes one shared map context to all agents for the duration of the run"}}
{"run":9,"commit":"f5ae4c5","metric":96394,"metrics":{},"status":"discard","description":"Discarded removal of send/system/interpreter hot-path logging because the measured total_µs regressed from 88,115 to 96,394 despite substantially reducing output volume.","timestamp":1775627256375,"segment":1,"confidence":null,"iterationTokens":7090,"asi":{"hypothesis":"The dominant cost in the successful baseline is per-message stdout/stderr logging in ar_system, ar_agency, ar_agent, ar_interpreter, and send evaluation, so removing those hot-path prints should improve total_µs.","rollback_reason":"Measured primary metric regressed versus the committed baseline, so this change is not a clear improvement yet.","next_action_hint":"Target the remaining hot-path DEBUG emitters visible in benchmark output (method evaluator, frame creation, memory access) or re-run a narrower logging-removal variant to separate noise from real effect.","learning":"Output volume dropped a lot, but the benchmark still emits many DEBUG lines from deeper evaluator/frame paths, and this broader logging-removal patch did not produce an immediate win on total_µs.","observed_remaining_logs":"DEBUG [METHOD_EVAL], DEBUG [MEMORY_ACCESS], DEBUG [FRAME_CREATE], plus agency lookup info lines remain in output."}}
{"run":10,"commit":"c5bdc9a","metric":80071,"metrics":{},"status":"keep","description":"Improved baseline by removing deeper per-message debug logging from frame creation, method evaluation, and message memory access while keeping the successful 100-agent benchmark harness intact.","timestamp":1775627307897,"segment":1,"confidence":9.954127299850821,"iterationTokens":7333,"asi":{"hypothesis":"The remaining dominant benchmark overhead after baseline establishment is deeper evaluator/frame debug logging on every processed message, so removing those logs should reduce total_µs even if higher-level system prints remain.","improvement_vs_baseline_µs":8044,"files_changed":"modules/ar_frame.c, modules/ar_method_evaluator.zig, modules/ar_expression_evaluator.zig","learning":"Removing deep evaluator/frame debug output produced a clear win to 80,071µs, so hot-path logging is a real bottleneck. The remaining obvious timed output is the per-message print in ar_system__process_next_message.","next_promising_step":"Try removing the remaining per-message output in ar_system__process_next_message and re-measure; if still worthwhile, inspect any residual logging on send paths."}}
{"run":11,"commit":"593ba3e","metric":79797,"metrics":{},"status":"keep","description":"Slightly improved total_µs by removing the remaining per-message stdout print from ar_system__process_next_message; benchmark output is now dominated by send/agent/interpreter debug logs.","timestamp":1775627358104,"segment":1,"confidence":19.186583313296467,"iterationTokens":3632,"asi":{"hypothesis":"The remaining stdout print in ar_system__process_next_message still adds measurable overhead to the timed loop even after deeper evaluator/frame debug logging was removed.","improvement_vs_previous_best_µs":274,"files_changed":"modules/ar_system.c","learning":"The system-level per-message print was still on the hot path and trimming it produced a small additional gain. Remaining benchmark output now comes mostly from DEBUG [SEND], DEBUG [AGENT_SEND], and DEBUG [INTERPRETER].","next_promising_step":"Remove send/agent/interpreter hot-path debug logging next and re-measure against the new 79,797µs baseline."}}
{"run":12,"commit":"29aad4a","metric":75569,"metrics":{},"status":"keep","description":"Improved total_µs by removing remaining send/agent/interpreter hot-path debug logging; benchmark output dropped to setup-time methodology lookup logs only.","timestamp":1775627404601,"segment":1,"confidence":16.78565082185695,"iterationTokens":1714,"asi":{"hypothesis":"The remaining per-message debug logging in ar_agency__send_to_agent, ar_agent__send, and ar_interpreter__execute_method is still a material throughput bottleneck after removing deeper evaluator/frame logs and system stdout.","improvement_vs_previous_best_µs":4228,"files_changed":"modules/ar_agency.c, modules/ar_agent.c, modules/ar_interpreter.c","learning":"This was a strong win, confirming that hot-path logging dominated runtime overhead. The remaining visible logs are methodology lookup info lines during benchmark setup, which are outside the timed loop.","next_promising_step":"Inspect structural overhead in message dispatch and agent scanning inside ar_system__process_next_message; removing O(agent_count) scanning per message may yield the next meaningful improvement."}}
{"run":13,"commit":"e933bfb","metric":15750,"metrics":{},"status":"keep","description":"Massively improved total_µs by adding a rolling next-agent search hint in ar_system__process_next_message, eliminating the repeated scan from the first agent on every message dispatch.","timestamp":1775627486292,"segment":1,"confidence":2.5107604017216643,"iterationTokens":5459,"asi":{"hypothesis":"After removing hot-path logging, the next dominant cost is the O(agent_count) scan from the first agent on every ar_system__process_next_message call; caching a rolling start point should reduce queue discovery to near-O(1) for workloads like the ring benchmark.","improvement_vs_previous_best_µs":59819,"files_changed":"modules/ar_system.c","algorithm_change":"Added next_agent_hint to ar_system state; message scanning now starts from the previous hit, wraps once through the registry, and resets when the agent set is empty or the hint becomes invalid.","learning":"Queue-discovery scanning was the overwhelming structural bottleneck. Starting each search near the last successful agent reduced total_µs from 75,569 to 15,750.","next_promising_step":"Inspect setup-time methodology lookup logging and agent-creation overhead only if future benchmarks include setup in the timed region; for the current timed loop, deeper structural costs are now much smaller."}}
{"run":14,"commit":"de48163","metric":15276,"metrics":{},"status":"keep","description":"Further improved queue dispatch by advancing the next-agent hint to the current agent only when it still has queued messages, otherwise to the next registry entry, avoiding one wasted check per handoff in the ring workload.","timestamp":1775627526970,"segment":1,"confidence":1.8364991584515509,"iterationTokens":1649,"asi":{"hypothesis":"The rolling search hint can be refined further by pointing directly at the most likely next message owner after execution instead of always restarting from the just-processed agent.","improvement_vs_previous_best_µs":474,"files_changed":"modules/ar_system.c","algorithm_refinement":"After execution, next_agent_hint now stays on the current agent only if it still has messages; otherwise it advances to the next registered agent and wraps to the first agent if needed.","learning":"Once the major scan bottleneck was removed, there was still a smaller but measurable cost from checking the already-emptied agent first on each handoff.","next_promising_step":"Look at lower-level ownership/copy overhead in send(message) and expression evaluation, especially claim_or_copy and repeated agency/method lookups inside the timed loop."}}
{"run":15,"commit":"40076cd","metric":14959,"metrics":{},"status":"keep","description":"Improved total_µs by removing the redundant agent_has_messages pre-check and probing queues directly with ar_agency__get_agent_message during dispatch scanning.","timestamp":1775627590964,"segment":1,"confidence":1.026593006897025,"iterationTokens":4851,"asi":{"hypothesis":"After optimizing the scan start point, the dispatch loop still wastes work by looking up each candidate agent twice—once for has_messages and again for get_agent_message—so collapsing to a single queue probe should help.","improvement_vs_previous_best_µs":317,"files_changed":"modules/ar_system.c","algorithm_refinement":"ar_system__process_next_message now attempts ar_agency__get_agent_message directly while scanning instead of calling ar_agency__agent_has_messages first.","learning":"Even after the large cursor optimization, duplicate registry/queue lookups in the hot path were still measurable.","next_promising_step":"Investigate whether ar_agency__get_agent_method/get_agent_mutable_memory/get_agent_context repeated registry lookups inside ar_interpreter__execute_method can be collapsed or cached."}}
{"run":16,"commit":"b1edc5d","metric":10157,"metrics":{},"status":"keep","description":"Collapsed three registry lookups per executed message into one by having ar_interpreter__execute_method fetch the agent once from the registry and then read method/memory/context directly from the agent.","timestamp":1775627639520,"segment":1,"confidence":0.48773109243697477,"iterationTokens":3747,"asi":{"hypothesis":"With dispatch scanning mostly fixed, repeated registry lookups inside ar_interpreter__execute_method are now a major hot-path cost; using one agent lookup instead of three agency wrapper lookups should improve total_µs.","improvement_vs_previous_best_µs":4802,"files_changed":"modules/ar_interpreter.c","algorithm_change":"Interpreter now gets the registry once, finds the target agent once, and calls ar_agent accessors directly for method, mutable memory, and context.","learning":"Registry lookup overhead remained substantial even after the dispatch cursor optimization. Eliminating two extra lookups per message cut total_µs from 14,959 to 10,157.","next_promising_step":"Inspect send-path lookups similarly: ar_agency__send_to_agent and ar_system dispatch still route through registry-based agent discovery that may be reducible or cacheable."}}
{"run":17,"commit":"11a3315","metric":7587,"metrics":{},"status":"keep","description":"Greatly improved registry hot-path performance by making ar_agent_registry find/untrack use direct formatted ID keys instead of scanning the registered-ID list to recover the key string before every map lookup.","timestamp":1775627769964,"segment":1,"confidence":0.22135990313498374,"iterationTokens":5346,"asi":{"hypothesis":"Agent registry lookup still does avoidable O(agent_count) work because find_agent first scans the registered ID list to reconstruct a key string; formatting the numeric ID directly should cut a large amount of hot-path overhead.","improvement_vs_previous_best_µs":2570,"files_changed":"modules/ar_agent_registry.c","algorithm_change":"ar_agent_registry__find_agent and ar_agent_registry__untrack_agent now build the numeric string key directly with snprintf and query/remove from ar_map without a preliminary registered-list scan.","learning":"Registry lookup design was still a major bottleneck. Eliminating the list scan before each map lookup dropped total_µs from 10,157 to 7,587.","next_promising_step":"Examine whether ar_map itself can avoid linear scans for these numeric-string keys or whether benchmark hot paths can bypass string-keyed maps altogether."}}
{"run":18,"commit":"11a3315","metric":7622,"metrics":{},"status":"discard","description":"Baseline re-run to measure noise on the current best registry-lookup optimization; total_µs landed slightly above the 7,587µs best, indicating low-thousands-of-ns jitter rather than a new regression.","timestamp":1775628009005,"segment":1,"confidence":0.9294377067254685,"iterationTokens":5346,"asi":{"hypothesis":"Re-running the current best commit will estimate benchmark noise before making the next structural optimization.","rollback_reason":"No code change; this run is a confirmation sample and did not beat the current best metric.","next_action_hint":"Pursue the next structural hot-path optimization, most likely reducing linear string-key scans in ar_map or avoiding repeated methodology lookup/logging during benchmark setup.","learning":"Current best appears stable around 7.6ms, so improvements now need to clear a relatively small noise floor."}}
