{"run":19,"commit":"a0944d6","metric":6257,"metrics":{},"status":"keep","description":"Improved total_µs by replacing ar_map's full-table linear string scan with hashed open addressing plus tombstones, cutting registry/map hot-path lookups across dispatch, send, and memory access.","timestamp":1775628114977,"segment":1,"confidence":0.7283203352345478,"iterationTokens":8228,"asi":{"hypothesis":"The next dominant overhead after direct agent-ID key formatting is ar_map itself, which still linearly scans all 128 slots on every lookup/update; switching to hashed open addressing should reduce registry and map access cost.","files_changed":"modules/ar_map.c","supporting_check":"make ar_map_tests 2>&1 passed before benchmarking","algorithm_change":"Added FNV-1a hashing, linear-probed open addressing, and tombstone-aware deletion while preserving the existing ar_map API and ownership semantics.","improvement_vs_previous_best_µs":1330,"learning":"Generic map lookup remained a major bottleneck even after registry-level improvements. Moving from O(MAP_SIZE) string scans to hash-guided probing reduced total_µs from 7,587 to 6,257.","next_action_hint":"Inspect remaining hot-path work in message dispatch and send/evaluation, especially repeated agent existence/next-agent queries and frame/message ownership operations."}}
{"run":20,"commit":"24e7f45","metric":4604,"metrics":{},"status":"keep","description":"Improved total_µs by making agent-registry iteration and membership O(1) with indexed next/prev/registered arrays, removing the per-message list copy/scan work in get_first/get_next/is_registered.","timestamp":1775628515155,"segment":1,"confidence":0.5104778800310455,"iterationTokens":43240,"asi":{"hypothesis":"After hashing ar_map, the next hot path is agent-registry traversal itself: get_first/get_next/is_registered still allocate list snapshots and scan/parse ID strings, so replacing those lookups with indexed linkage should reduce dispatch overhead further.","files_changed":"modules/ar_agent_registry.c","supporting_checks":"make ar_agent_registry_tests 2>&1 and make ar_map_tests 2>&1 both passed before benchmarking","algorithm_change":"Agent registry now maintains first/last IDs plus indexed next/prev/registered/key arrays alongside the existing ID-string list, making iteration and membership checks O(1) while preserving public behavior and stable key ownership.","improvement_vs_previous_best_µs":1653,"learning":"Even after fixing map lookup complexity, registry traversal remained a major bottleneck. Eliminating list snapshot allocation and repeated string-to-int parsing cut total_µs from 6,257 to 4,604.","next_action_hint":"Investigate expression-evaluator memory access overhead next, especially per-message path-array/full-path allocation for memory.next_id and message access."}}
{"run":21,"commit":"63c4358","metric":3765,"metrics":{},"status":"keep","description":"Improved total_µs by removing per-message argument-list snapshot allocation in send evaluation, using ar_list__first/ar_list__last instead of ar_list__items for the fixed two-argument send AST.","timestamp":1775628571148,"segment":1,"confidence":0.3886652214307835,"iterationTokens":4180,"asi":{"hypothesis":"Send evaluation still allocates an array for its two fixed argument ASTs on every message; replacing that with direct first/last list access should trim allocator and copy overhead in the hot path.","files_changed":"modules/ar_send_instruction_evaluator.zig","supporting_check":"make ar_send_instruction_evaluator_tests 2>&1 passed before benchmarking","algorithm_change":"ar_send_instruction_evaluator__evaluate now reads the two send arguments directly from the list without allocating a temporary items array.","improvement_vs_previous_best_µs":839,"learning":"Small per-message allocations are still materially expensive at this scale. Removing just one temporary array allocation per message reduced total_µs from 4,604 to 3,765.","next_action_hint":"Look for similar fixed-arity or repeated list/path snapshot allocations in expression and instruction evaluation, especially memory-access evaluation."}}
{"run":22,"commit":"b11a30d","metric":3125,"metrics":{},"status":"keep","description":"Improved total_µs by avoiding memory-path snapshot and full-path allocation for the common single-segment access case, using new borrowed AST path accessors so memory.next_id/message access stay allocation-free.","timestamp":1775628748441,"segment":1,"confidence":0.30178657653307583,"iterationTokens":10641,"asi":{"hypothesis":"Expression evaluation still allocates path arrays and concatenated path strings for each memory access; the benchmark's hot path only needs zero- or one-segment accesses, so fast-pathing those should reduce allocator overhead further.","files_changed":"modules/ar_expression_ast.h, modules/ar_expression_ast.zig, modules/ar_expression_evaluator.zig","supporting_checks":"make ar_expression_ast_tests 2>&1, make ar_expression_evaluator_tests 2>&1, and make ar_send_instruction_evaluator_tests 2>&1 all passed before benchmarking","algorithm_change":"Added borrowed memory-path count/component AST accessors and taught the expression evaluator to bypass path-array/full-string allocation for zero- and one-segment accesses.","improvement_vs_previous_best_µs":640,"learning":"Memory-access path materialization was still expensive in the ring benchmark. Fast-pathing simple access patterns reduced total_µs from 3,765 to 3,125.","next_action_hint":"Probe remaining hot-path allocations and ownership churn next, especially message/frame ownership transitions and any residual list snapshot creation in evaluator/executor code."}}
{"run":23,"commit":"eaff80b","metric":1936,"metrics":{},"status":"keep","description":"Improved total_µs by reusing a single execution frame inside the interpreter instead of heap-allocating and freeing a fresh ar_frame for every processed message.","timestamp":1775628899242,"segment":1,"confidence":0.2312055890607273,"iterationTokens":15568,"asi":{"hypothesis":"Per-message frame allocation/destruction is still on the hot path; caching one frame inside the interpreter and rebinding it for each execution should remove allocator churn without changing behavior.","files_changed":"modules/ar_frame.h, modules/ar_frame.c, modules/ar_interpreter.c","supporting_checks":"make ar_frame_tests 2>&1, make ar_interpreter_tests 2>&1, and make ar_interpreter_fixture_tests 2>&1 all passed before benchmarking","algorithm_change":"Added ar_frame__reset and changed ar_interpreter to lazily allocate one reusable frame, resetting its references on each execute_method call instead of recreating it.","improvement_vs_previous_best_µs":1189,"learning":"Frame allocation was a major remaining hotspot. Eliminating one heap allocation/free pair per message cut total_µs from 3,125 to 1,936.","next_action_hint":"Investigate message-value ownership/copy overhead next, especially the claim_or_copy path for forwarding the current message through send(message)."}}
